bank,header,level,manual_labels,manual_notes,is_shuffled,H_subheadings,L_subheadings,L_subheadings_notes,L_subheadings_2,L_subheadings_2_notes
barclays_m,11. Confidentiality and Data Protection,1,0,,0,0,1,"Confidentiality and data protection are important legal considerations, but they don't seem directly related to the supply of services.",0,"Yes, this heading is clearly relevant to its parent heading ""In these Terms and Conditions the following definitions shall apply"" as it defines another key concept."
barclays_m,12. Indemnity and Insurance,1,0,,0,0,1,"Indemnity and insurance are likely important legal considerations, but they don't seem directly related to the supply of services.",0,"Yes, this heading is clearly relevant to its parent heading ""In these Terms and Conditions the following definitions shall apply"" as it defines another key concept."
barclays_m,13. Liability,1,0,,0,0,1,"Liability is likely an important legal consideration, but it doesn't seem directly related to the supply of services.",0,"Yes, this heading is clearly relevant to its parent heading ""In these Terms and Conditions the following definitions shall apply"" as it defines another key concept."
barclays_m,14. Term and Termination,1,0,,0,0,1,"Term and termination are likely important legal considerations, but they don't seem directly related to the supply of services.",0,"Yes, this heading is clearly relevant to its parent heading ""In these Terms and Conditions the following definitions shall apply"" as it defines another key concept."
barclays_m,15. General,1,0,,0,0,1,"The heading ""General"" is too vague to be considered relevant to the supply of services.",1,"No, this heading seems too broad and vague. It could encompass many different topics, making it unclear what specific information it will provide."
barclays_m,16. Anti-Bribery,1,0,,1,1,1,"Anti-bribery is likely an important legal consideration, but it doesn't seem directly related to the supply of services.",0,"Yes, this heading is clearly relevant to its parent heading ""In these Terms and Conditions the following definitions shall apply"" as it defines another key concept."
barclays_m,17. Governing Law and Jurisdiction,1,0,,0,0,1,"Governing law and jurisdiction are likely important legal considerations, but they don't seem directly related to the supply of services.",0,"Yes, this heading is clearly relevant to its parent heading ""In these Terms and Conditions the following definitions shall apply"" as it defines another key concept."
barclays_m,18. Disclosure,1,0,,0,0,1,"Disclosure is likely an important legal consideration, but it doesn't seem directly related to the supply of services.",0,"Yes, this heading is clearly relevant to its parent heading ""In these Terms and Conditions the following definitions shall apply"" as it defines another key concept."
barclays_m,19. Entire Agreement,1,0,,0,0,1,"Entire agreement is likely an important legal consideration, but it doesn't seem directly related to the supply of services.",0,"Yes, this heading is clearly relevant to its parent heading ""In these Terms and Conditions the following definitions shall apply"" as it defines another key concept."
barclays_m,20. United States Government Contact,1,0,,0,0,1,United States Government contact information is likely an administrative detail rather than a relevant aspect of the supply of services.,1,"No, this heading seems unrelated to the definitions provided earlier. It may be better suited as a standalone section or footnote."
barclays_m,How We will use personal information about You,1,1,improper formatting consistency,1,1,1,"""How We will use personal information about You"" is likely an important privacy notice, but it doesn't seem directly related to the supply of services.",1,"No, this heading seems unrelated to the definitions provided earlier. It may be better suited as a standalone section or policy statement."